firebase_id,prolific_pid,session_id,sentence_set_id,total_time_taken,question_id,question_index,statement_id,statement_text,name,gender,uncertainty_expression,response,time_taken
iePT3JpFPSUwlpegjxbVqQ3Ulwl2,5ee5e3b02eebe932ee9559c5,6625d6ce6c9ab878d9c55395,4__future__possession,1136.853,15,26,possession_0,Laura believes it's probable that her boss owns a blue car.,Laura,female,probable,70,14.557
iePT3JpFPSUwlpegjxbVqQ3Ulwl2,5ee5e3b02eebe932ee9559c5,6625d6ce6c9ab878d9c55395,4__future__possession,1136.853,22,27,possession_7,Raul believes it's not likely that his neighbors have two tickets to the concert in town next Friday.,Raul,male,not likely,20,27.734
iePT3JpFPSUwlpegjxbVqQ3Ulwl2,5ee5e3b02eebe932ee9559c5,6625d6ce6c9ab878d9c55395,4__future__possession,1136.853,25,28,possession_10,Isaac believes it's highly unlikely that his cousin owns a high-quality camera.,Isaac,male,highly unlikely,5,16.184
iePT3JpFPSUwlpegjxbVqQ3Ulwl2,5ee5e3b02eebe932ee9559c5,6625d6ce6c9ab878d9c55395,4__future__possession,1136.853,7,29,future_7,Cheri believes it's not likely that there will be pastries provided at the meeting next Monday.,Cheri,female,not likely,20,37.451
iePT3JpFPSUwlpegjxbVqQ3Ulwl2,5ee5e3b02eebe932ee9559c5,6625d6ce6c9ab878d9c55395,4__future__possession,1136.853,1,30,future_1,Ethel believes it's likely that she will be offered a promotion this fall.,Ethel,female,likely,80,32.038000000000004
uEBNgXRAduWuo6emTuhgHudN1bF3,6413665e5dec6a98797ef5ab,6625d6d0e0b807208527c58d,0__imperfect_knowledge__preference,162.231,10,1,imperfect_knowledge_10,Roxanne believes it's unlikely that the hiking trail is 10 miles long.,Roxanne,female,unlikely,20,17.286
uEBNgXRAduWuo6emTuhgHudN1bF3,6413665e5dec6a98797ef5ab,6625d6d0e0b807208527c58d,0__imperfect_knowledge__preference,162.231,5,2,imperfect_knowledge_5,David believes it's likely that his presentation on macroeconomics takes 45 minutes.,David,male,likely,80,4.42
uEBNgXRAduWuo6emTuhgHudN1bF3,6413665e5dec6a98797ef5ab,6625d6d0e0b807208527c58d,0__imperfect_knowledge__preference,162.231,13,3,imperfect_knowledge_13,Lance believes it's very unlikely that his boss meets the new client at least two times per week.,Lance,male,very unlikely,0,4.48
uEBNgXRAduWuo6emTuhgHudN1bF3,6413665e5dec6a98797ef5ab,6625d6d0e0b807208527c58d,0__imperfect_knowledge__preference,162.231,28,4,preference_13,Tara believes it's very unlikely that her cousin prefers headphones over earbuds.,Tara,female,very unlikely,0,2.149
uEBNgXRAduWuo6emTuhgHudN1bF3,6413665e5dec6a98797ef5ab,6625d6d0e0b807208527c58d,0__imperfect_knowledge__preference,162.231,15,5,preference_0,Laura believes her cousin prefers spinach over broccoli.,Laura,female,control,60,3.586
uEBNgXRAduWuo6emTuhgHudN1bF3,6413665e5dec6a98797ef5ab,6625d6d0e0b807208527c58d,0__imperfect_knowledge__preference,162.231,9,6,imperfect_knowledge_9,Marco believes it's possible that the local college baseball game starts at 9am on Sunday.,Marco,male,possible,65,4.479
uEBNgXRAduWuo6emTuhgHudN1bF3,6413665e5dec6a98797ef5ab,6625d6d0e0b807208527c58d,0__imperfect_knowledge__preference,162.231,4,7,imperfect_knowledge_4,Kenny believes it's probable that the temperature in the office is at least 72 degrees Fahrenheit.,Kenny,male,probable,80,2.516
uEBNgXRAduWuo6emTuhgHudN1bF3,6413665e5dec6a98797ef5ab,6625d6d0e0b807208527c58d,0__imperfect_knowledge__preference,162.231,17,8,preference_2,Amanda believes it's highly likely that her friend prefers running over cycling.,Amanda,female,highly likely,100,3.215
uEBNgXRAduWuo6emTuhgHudN1bF3,6413665e5dec6a98797ef5ab,6625d6d0e0b807208527c58d,0__imperfect_knowledge__preference,162.231,26,9,preference_11,Violet believes it's not likely that her neighbor prefers dogs over cats.,Violet,female,not likely,30,3.758
uEBNgXRAduWuo6emTuhgHudN1bF3,6413665e5dec6a98797ef5ab,6625d6d0e0b807208527c58d,0__imperfect_knowledge__preference,162.231,19,10,preference_4,Nick believes it's probable that his coworker prefers reading books over watching movies.,Nick,male,probable,65,3.033
uEBNgXRAduWuo6emTuhgHudN1bF3,6413665e5dec6a98797ef5ab,6625d6d0e0b807208527c58d,0__imperfect_knowledge__preference,162.231,8,11,imperfect_knowledge_8,Camille believes it's uncertain that she can derive the theorem presented in class today within 5 minutes.,Camille,female,uncertain,50,9.169
uEBNgXRAduWuo6emTuhgHudN1bF3,6413665e5dec6a98797ef5ab,6625d6d0e0b807208527c58d,0__imperfect_knowledge__preference,162.231,1,12,imperfect_knowledge_1,Ethel believes it's almost certain that the new museum is offering complimentary admission.,Ethel,female,almost certain,90,3.327
uEBNgXRAduWuo6emTuhgHudN1bF3,6413665e5dec6a98797ef5ab,6625d6d0e0b807208527c58d,0__imperfect_knowledge__preference,162.231,23,13,preference_8,Olga believes it's uncertain that her neighbor prefers sunrise over sunset.,Olga,female,uncertain,35,4.501
uEBNgXRAduWuo6emTuhgHudN1bF3,6413665e5dec6a98797ef5ab,6625d6d0e0b807208527c58d,0__imperfect_knowledge__preference,162.231,25,14,preference_10,Isaac believes it's unlikely that his boss prefers working remotely over working in-person.,Isaac,male,unlikely,25,2.809
uEBNgXRAduWuo6emTuhgHudN1bF3,6413665e5dec6a98797ef5ab,6625d6d0e0b807208527c58d,0__imperfect_knowledge__preference,162.231,18,15,preference_3,Jacquelyn believes it's very likely that her neighbor prefers the beach over the mountains.,Jacquelyn,female,very likely,100,4.377
uEBNgXRAduWuo6emTuhgHudN1bF3,6413665e5dec6a98797ef5ab,6625d6d0e0b807208527c58d,0__imperfect_knowledge__preference,162.231,0,16,imperfect_knowledge_0,Gabriela believes the restaurant near her apartment accepts reservations.,Gabriela,female,control,70,2.229
uEBNgXRAduWuo6emTuhgHudN1bF3,6413665e5dec6a98797ef5ab,6625d6d0e0b807208527c58d,0__imperfect_knowledge__preference,162.231,3,17,imperfect_knowledge_3,Mike believes it's very likely that there are more than eighty students in the auditorium right now.,Mike,male,very likely,100,1.941
uEBNgXRAduWuo6emTuhgHudN1bF3,6413665e5dec6a98797ef5ab,6625d6d0e0b807208527c58d,0__imperfect_knowledge__preference,162.231,7,18,imperfect_knowledge_7,Cheri believes it's somewhat unlikely that her friend can do a handstand.,Cheri,female,somewhat unlikely,40,2.992
uEBNgXRAduWuo6emTuhgHudN1bF3,6413665e5dec6a98797ef5ab,6625d6d0e0b807208527c58d,0__imperfect_knowledge__preference,162.231,22,19,preference_7,Raul believes it's somewhat unlikely that his friend prefers stargazing over birdwatching.,Raul,male,somewhat unlikely,40,2.6510000000000002
uEBNgXRAduWuo6emTuhgHudN1bF3,6413665e5dec6a98797ef5ab,6625d6d0e0b807208527c58d,0__imperfect_knowledge__preference,162.231,20,20,preference_5,Johnnie believes it's likely that his cousin prefers summer over winter.,Johnnie,male,likely,65,2.3850000000000002
uEBNgXRAduWuo6emTuhgHudN1bF3,6413665e5dec6a98797ef5ab,6625d6d0e0b807208527c58d,0__imperfect_knowledge__preference,162.231,12,21,imperfect_knowledge_12,Bonnie believes it's doubtful that she can recall the names of at least seventy countries.,Bonnie,female,doubtful,15,2.213
uEBNgXRAduWuo6emTuhgHudN1bF3,6413665e5dec6a98797ef5ab,6625d6d0e0b807208527c58d,0__imperfect_knowledge__preference,162.231,16,22,preference_1,Jessica believes it's almost certain that her boss prefers coffee over tea.,Jessica,female,almost certain,90,2.527
uEBNgXRAduWuo6emTuhgHudN1bF3,6413665e5dec6a98797ef5ab,6625d6d0e0b807208527c58d,0__imperfect_knowledge__preference,162.231,2,23,imperfect_knowledge_2,Silvia believes it's highly likely that there is a yoga studio within 2 miles of her workplace.,Silvia,female,highly likely,100,2.037
uEBNgXRAduWuo6emTuhgHudN1bF3,6413665e5dec6a98797ef5ab,6625d6d0e0b807208527c58d,0__imperfect_knowledge__preference,162.231,21,24,preference_6,Catherine believes it's somewhat likely that her boss prefers yoga over pilates.,Catherine,female,somewhat likely,60,2.943
uEBNgXRAduWuo6emTuhgHudN1bF3,6413665e5dec6a98797ef5ab,6625d6d0e0b807208527c58d,0__imperfect_knowledge__preference,162.231,27,25,preference_12,Brendan believes it's doubtful that his friend prefers science fiction books over fantasy books.,Brendan,male,doubtful,35,2.125
uEBNgXRAduWuo6emTuhgHudN1bF3,6413665e5dec6a98797ef5ab,6625d6d0e0b807208527c58d,0__imperfect_knowledge__preference,162.231,29,26,preference_14,Jeffery believes it's highly unlikely that his neighbor prefers dancing over singing.,Jeffery,male,highly unlikely,0,2.24
uEBNgXRAduWuo6emTuhgHudN1bF3,6413665e5dec6a98797ef5ab,6625d6d0e0b807208527c58d,0__imperfect_knowledge__preference,162.231,14,27,imperfect_knowledge_14,Joey believes it's highly unlikely that everything fits in his suitcase.,Joey,male,highly unlikely,0,2.447
uEBNgXRAduWuo6emTuhgHudN1bF3,6413665e5dec6a98797ef5ab,6625d6d0e0b807208527c58d,0__imperfect_knowledge__preference,162.231,24,28,preference_9,Bruce believes it's possible that his coworker prefers Chinese food over Mexican food.,Bruce,male,possible,60,4.847
uEBNgXRAduWuo6emTuhgHudN1bF3,6413665e5dec6a98797ef5ab,6625d6d0e0b807208527c58d,0__imperfect_knowledge__preference,162.231,6,29,imperfect_knowledge_6,Nathan believes it's somewhat likely that he can fix a flat tire.,Nathan,male,somewhat likely,40,3.079
uEBNgXRAduWuo6emTuhgHudN1bF3,6413665e5dec6a98797ef5ab,6625d6d0e0b807208527c58d,0__imperfect_knowledge__preference,162.231,11,30,imperfect_knowledge_11,Gary believes it's not likely that his flight will land around 6pm.,Gary,male,not likely,25,2.644
r2J7hIO2gDRyEJEXtneMBzrn8Kr1,63c0dca0dc55e97ff8295cd6,6625d6d1aa533cc08655e044,11__imperfect_knowledge__preference,588.654,22,1,preference_7,Raul believes it's very likely that his friend prefers stargazing over birdwatching.,Raul,male,very likely,85,14.602
r2J7hIO2gDRyEJEXtneMBzrn8Kr1,63c0dca0dc55e97ff8295cd6,6625d6d1aa533cc08655e044,11__imperfect_knowledge__preference,588.654,20,2,preference_5,Johnnie believes it's almost certain that his cousin prefers summer over winter.,Johnnie,male,almost certain,80,9.739
r2J7hIO2gDRyEJEXtneMBzrn8Kr1,63c0dca0dc55e97ff8295cd6,6625d6d1aa533cc08655e044,11__imperfect_knowledge__preference,588.654,28,3,preference_13,Tara believes it's possible that her cousin prefers headphones over earbuds.,Tara,female,possible,55,12.89
r2J7hIO2gDRyEJEXtneMBzrn8Kr1,63c0dca0dc55e97ff8295cd6,6625d6d1aa533cc08655e044,11__imperfect_knowledge__preference,588.654,29,4,preference_14,Jeffery believes it's unlikely that his neighbor prefers dancing over singing.,Jeffery,male,unlikely,20,24.653000000000002
r2J7hIO2gDRyEJEXtneMBzrn8Kr1,63c0dca0dc55e97ff8295cd6,6625d6d1aa533cc08655e044,11__imperfect_knowledge__preference,588.654,11,5,imperfect_knowledge_11,Gary believes it's somewhat unlikely that his flight will land around 6pm.,Gary,male,somewhat unlikely,30,15.337
r2J7hIO2gDRyEJEXtneMBzrn8Kr1,63c0dca0dc55e97ff8295cd6,6625d6d1aa533cc08655e044,11__imperfect_knowledge__preference,588.654,7,6,imperfect_knowledge_7,Cheri believes it's very likely that her friend can do a handstand.,Cheri,female,very likely,85,10.075000000000001
r2J7hIO2gDRyEJEXtneMBzrn8Kr1,63c0dca0dc55e97ff8295cd6,6625d6d1aa533cc08655e044,11__imperfect_knowledge__preference,588.654,25,7,preference_10,Isaac believes it's somewhat likely that his boss prefers working remotely over working in-person.,Isaac,male,somewhat likely,60,11.145
r2J7hIO2gDRyEJEXtneMBzrn8Kr1,63c0dca0dc55e97ff8295cd6,6625d6d1aa533cc08655e044,11__imperfect_knowledge__preference,588.654,16,8,preference_1,Jessica believes it's doubtful that her boss prefers coffee over tea.,Jessica,female,doubtful,25,16.328
r2J7hIO2gDRyEJEXtneMBzrn8Kr1,63c0dca0dc55e97ff8295cd6,6625d6d1aa533cc08655e044,11__imperfect_knowledge__preference,588.654,3,9,imperfect_knowledge_3,Mike believes it's highly unlikely that there are more than eighty students in the auditorium right now.,Mike,male,highly unlikely,15,19.496
r2J7hIO2gDRyEJEXtneMBzrn8Kr1,63c0dca0dc55e97ff8295cd6,6625d6d1aa533cc08655e044,11__imperfect_knowledge__preference,588.654,12,10,imperfect_knowledge_12,Bonnie believes it's uncertain that she can recall the names of at least seventy countries.,Bonnie,female,uncertain,35,25.463
r2J7hIO2gDRyEJEXtneMBzrn8Kr1,63c0dca0dc55e97ff8295cd6,6625d6d1aa533cc08655e044,11__imperfect_knowledge__preference,588.654,26,11,preference_11,Violet believes it's somewhat unlikely that her neighbor prefers dogs over cats.,Violet,female,somewhat unlikely,30,16.011
r2J7hIO2gDRyEJEXtneMBzrn8Kr1,63c0dca0dc55e97ff8295cd6,6625d6d1aa533cc08655e044,11__imperfect_knowledge__preference,588.654,6,12,imperfect_knowledge_6,Nathan believes it's highly likely that he can fix a flat tire.,Nathan,male,highly likely,85,44.329
r2J7hIO2gDRyEJEXtneMBzrn8Kr1,63c0dca0dc55e97ff8295cd6,6625d6d1aa533cc08655e044,11__imperfect_knowledge__preference,588.654,10,13,imperfect_knowledge_10,Roxanne believes it's somewhat likely that the hiking trail is 10 miles long.,Roxanne,female,somewhat likely,65,17.565
r2J7hIO2gDRyEJEXtneMBzrn8Kr1,63c0dca0dc55e97ff8295cd6,6625d6d1aa533cc08655e044,11__imperfect_knowledge__preference,588.654,9,14,imperfect_knowledge_9,Marco believes it's likely that the local college baseball game starts at 9am on Sunday.,Marco,male,likely,85,13.788
r2J7hIO2gDRyEJEXtneMBzrn8Kr1,63c0dca0dc55e97ff8295cd6,6625d6d1aa533cc08655e044,11__imperfect_knowledge__preference,588.654,4,15,imperfect_knowledge_4,Kenny believes the temperature in the office is at least 72 degrees Fahrenheit.,Kenny,male,control,90,13.747
r2J7hIO2gDRyEJEXtneMBzrn8Kr1,63c0dca0dc55e97ff8295cd6,6625d6d1aa533cc08655e044,11__imperfect_knowledge__preference,588.654,8,16,imperfect_knowledge_8,Camille believes it's probable that she can derive the theorem presented in class today within 5 minutes.,Camille,female,probable,90,18.39
r2J7hIO2gDRyEJEXtneMBzrn8Kr1,63c0dca0dc55e97ff8295cd6,6625d6d1aa533cc08655e044,11__imperfect_knowledge__preference,588.654,5,17,imperfect_knowledge_5,David believes it's almost certain that his presentation on macroeconomics takes 45 minutes.,David,male,almost certain,90,11.903
r2J7hIO2gDRyEJEXtneMBzrn8Kr1,63c0dca0dc55e97ff8295cd6,6625d6d1aa533cc08655e044,11__imperfect_knowledge__preference,588.654,14,18,imperfect_knowledge_14,Joey believes it's unlikely that everything fits in his suitcase.,Joey,male,unlikely,25,12.058
r2J7hIO2gDRyEJEXtneMBzrn8Kr1,63c0dca0dc55e97ff8295cd6,6625d6d1aa533cc08655e044,11__imperfect_knowledge__preference,588.654,19,19,preference_4,Nick believes his coworker prefers reading books over watching movies.,Nick,male,control,75,12.9
r2J7hIO2gDRyEJEXtneMBzrn8Kr1,63c0dca0dc55e97ff8295cd6,6625d6d1aa533cc08655e044,11__imperfect_knowledge__preference,588.654,15,20,preference_0,Laura believes it's not likely that her cousin prefers spinach over broccoli.,Laura,female,not likely,20,11.353
r2J7hIO2gDRyEJEXtneMBzrn8Kr1,63c0dca0dc55e97ff8295cd6,6625d6d1aa533cc08655e044,11__imperfect_knowledge__preference,588.654,21,21,preference_6,Catherine believes it's highly likely that her boss prefers yoga over pilates.,Catherine,female,highly likely,90,9.177
r2J7hIO2gDRyEJEXtneMBzrn8Kr1,63c0dca0dc55e97ff8295cd6,6625d6d1aa533cc08655e044,11__imperfect_knowledge__preference,588.654,2,22,imperfect_knowledge_2,Silvia believes it's very unlikely that there is a yoga studio within 2 miles of her workplace.,Silvia,female,very unlikely,15,8.961
r2J7hIO2gDRyEJEXtneMBzrn8Kr1,63c0dca0dc55e97ff8295cd6,6625d6d1aa533cc08655e044,11__imperfect_knowledge__preference,588.654,17,23,preference_2,Amanda believes it's very unlikely that her friend prefers running over cycling.,Amanda,female,very unlikely,20,11.544
r2J7hIO2gDRyEJEXtneMBzrn8Kr1,63c0dca0dc55e97ff8295cd6,6625d6d1aa533cc08655e044,11__imperfect_knowledge__preference,588.654,23,24,preference_8,Olga believes it's probable that her neighbor prefers sunrise over sunset.,Olga,female,probable,85,9.549
r2J7hIO2gDRyEJEXtneMBzrn8Kr1,63c0dca0dc55e97ff8295cd6,6625d6d1aa533cc08655e044,11__imperfect_knowledge__preference,588.654,13,25,imperfect_knowledge_13,Lance believes it's possible that his boss meets the new client at least two times per week.,Lance,male,possible,60,14.471
r2J7hIO2gDRyEJEXtneMBzrn8Kr1,63c0dca0dc55e97ff8295cd6,6625d6d1aa533cc08655e044,11__imperfect_knowledge__preference,588.654,27,26,preference_12,Brendan believes it's uncertain that his friend prefers science fiction books over fantasy books.,Brendan,male,uncertain,40,9.395
r2J7hIO2gDRyEJEXtneMBzrn8Kr1,63c0dca0dc55e97ff8295cd6,6625d6d1aa533cc08655e044,11__imperfect_knowledge__preference,588.654,18,27,preference_3,Jacquelyn believes it's highly unlikely that her neighbor prefers the beach over the mountains.,Jacquelyn,female,highly unlikely,15,11.305
r2J7hIO2gDRyEJEXtneMBzrn8Kr1,63c0dca0dc55e97ff8295cd6,6625d6d1aa533cc08655e044,11__imperfect_knowledge__preference,588.654,24,28,preference_9,Bruce believes it's likely that his coworker prefers Chinese food over Mexican food.,Bruce,male,likely,75,29.583000000000002
r2J7hIO2gDRyEJEXtneMBzrn8Kr1,63c0dca0dc55e97ff8295cd6,6625d6d1aa533cc08655e044,11__imperfect_knowledge__preference,588.654,0,29,imperfect_knowledge_0,Gabriela believes it's not likely that the restaurant near her apartment accepts reservations.,Gabriela,female,not likely,25,9.606
r2J7hIO2gDRyEJEXtneMBzrn8Kr1,63c0dca0dc55e97ff8295cd6,6625d6d1aa533cc08655e044,11__imperfect_knowledge__preference,588.654,1,30,imperfect_knowledge_1,Ethel believes it's doubtful that the new museum is offering complimentary admission.,Ethel,female,doubtful,20,11.838000000000001
GSYId1BFlpP3Dz5ej6oUtIMxjKK2,63dd3dd2593c92be97d8dbde,6625d6d2ec6c3c89f6d9b3ea,10__imperfect_knowledge__preference,161.71,14,1,imperfect_knowledge_14,Joey believes it's possible that everything fits in his suitcase.,Joey,male,possible,65,8.361
GSYId1BFlpP3Dz5ej6oUtIMxjKK2,63dd3dd2593c92be97d8dbde,6625d6d2ec6c3c89f6d9b3ea,10__imperfect_knowledge__preference,161.71,24,2,preference_9,Bruce believes it's probable that his coworker prefers Chinese food over Mexican food.,Bruce,male,probable,30,4.5280000000000005
GSYId1BFlpP3Dz5ej6oUtIMxjKK2,63dd3dd2593c92be97d8dbde,6625d6d2ec6c3c89f6d9b3ea,10__imperfect_knowledge__preference,161.71,6,3,imperfect_knowledge_6,Nathan believes it's almost certain that he can fix a flat tire.,Nathan,male,almost certain,90,3.416
GSYId1BFlpP3Dz5ej6oUtIMxjKK2,63dd3dd2593c92be97d8dbde,6625d6d2ec6c3c89f6d9b3ea,10__imperfect_knowledge__preference,161.71,7,4,imperfect_knowledge_7,Cheri believes it's highly likely that her friend can do a handstand.,Cheri,female,highly likely,75,3.0
GSYId1BFlpP3Dz5ej6oUtIMxjKK2,63dd3dd2593c92be97d8dbde,6625d6d2ec6c3c89f6d9b3ea,10__imperfect_knowledge__preference,161.71,17,5,preference_2,Amanda believes it's doubtful that her friend prefers running over cycling.,Amanda,female,doubtful,25,4.744
GSYId1BFlpP3Dz5ej6oUtIMxjKK2,63dd3dd2593c92be97d8dbde,6625d6d2ec6c3c89f6d9b3ea,10__imperfect_knowledge__preference,161.71,29,6,preference_14,Jeffery believes it's possible that his neighbor prefers dancing over singing.,Jeffery,male,possible,60,2.68
GSYId1BFlpP3Dz5ej6oUtIMxjKK2,63dd3dd2593c92be97d8dbde,6625d6d2ec6c3c89f6d9b3ea,10__imperfect_knowledge__preference,161.71,18,7,preference_3,Jacquelyn believes it's very unlikely that her neighbor prefers the beach over the mountains.,Jacquelyn,female,very unlikely,10,2.536
GSYId1BFlpP3Dz5ej6oUtIMxjKK2,63dd3dd2593c92be97d8dbde,6625d6d2ec6c3c89f6d9b3ea,10__imperfect_knowledge__preference,161.71,1,8,imperfect_knowledge_1,Ethel believes it's not likely that the new museum is offering complimentary admission.,Ethel,female,not likely,0,3.976
GSYId1BFlpP3Dz5ej6oUtIMxjKK2,63dd3dd2593c92be97d8dbde,6625d6d2ec6c3c89f6d9b3ea,10__imperfect_knowledge__preference,161.71,19,9,preference_4,Nick believes it's highly unlikely that his coworker prefers reading books over watching movies.,Nick,male,highly unlikely,5,5.856
GSYId1BFlpP3Dz5ej6oUtIMxjKK2,63dd3dd2593c92be97d8dbde,6625d6d2ec6c3c89f6d9b3ea,10__imperfect_knowledge__preference,161.71,3,10,imperfect_knowledge_3,Mike believes it's very unlikely that there are more than eighty students in the auditorium right now.,Mike,male,very unlikely,20,2.544
GSYId1BFlpP3Dz5ej6oUtIMxjKK2,63dd3dd2593c92be97d8dbde,6625d6d2ec6c3c89f6d9b3ea,10__imperfect_knowledge__preference,161.71,11,11,imperfect_knowledge_11,Gary believes it's somewhat likely that his flight will land around 6pm.,Gary,male,somewhat likely,65,2.904
GSYId1BFlpP3Dz5ej6oUtIMxjKK2,63dd3dd2593c92be97d8dbde,6625d6d2ec6c3c89f6d9b3ea,10__imperfect_knowledge__preference,161.71,5,12,imperfect_knowledge_5,David believes his presentation on macroeconomics takes 45 minutes.,David,male,control,65,5.649
GSYId1BFlpP3Dz5ej6oUtIMxjKK2,63dd3dd2593c92be97d8dbde,6625d6d2ec6c3c89f6d9b3ea,10__imperfect_knowledge__preference,161.71,12,13,imperfect_knowledge_12,Bonnie believes it's somewhat unlikely that she can recall the names of at least seventy countries.,Bonnie,female,somewhat unlikely,30,3.208
GSYId1BFlpP3Dz5ej6oUtIMxjKK2,63dd3dd2593c92be97d8dbde,6625d6d2ec6c3c89f6d9b3ea,10__imperfect_knowledge__preference,161.71,23,14,preference_8,Olga believes it's very likely that her neighbor prefers sunrise over sunset.,Olga,female,very likely,80,3.841
GSYId1BFlpP3Dz5ej6oUtIMxjKK2,63dd3dd2593c92be97d8dbde,6625d6d2ec6c3c89f6d9b3ea,10__imperfect_knowledge__preference,161.71,21,15,preference_6,Catherine believes it's almost certain that her boss prefers yoga over pilates.,Catherine,female,almost certain,90,3.0
GSYId1BFlpP3Dz5ej6oUtIMxjKK2,63dd3dd2593c92be97d8dbde,6625d6d2ec6c3c89f6d9b3ea,10__imperfect_knowledge__preference,161.71,16,16,preference_1,Jessica believes it's not likely that her boss prefers coffee over tea.,Jessica,female,not likely,5,6.881
GSYId1BFlpP3Dz5ej6oUtIMxjKK2,63dd3dd2593c92be97d8dbde,6625d6d2ec6c3c89f6d9b3ea,10__imperfect_knowledge__preference,161.71,27,17,preference_12,Brendan believes it's somewhat unlikely that his friend prefers science fiction books over fantasy books.,Brendan,male,somewhat unlikely,35,3.2
GSYId1BFlpP3Dz5ej6oUtIMxjKK2,63dd3dd2593c92be97d8dbde,6625d6d2ec6c3c89f6d9b3ea,10__imperfect_knowledge__preference,161.71,0,18,imperfect_knowledge_0,Gabriela believes it's unlikely that the restaurant near her apartment accepts reservations.,Gabriela,female,unlikely,15,2.7840000000000003
GSYId1BFlpP3Dz5ej6oUtIMxjKK2,63dd3dd2593c92be97d8dbde,6625d6d2ec6c3c89f6d9b3ea,10__imperfect_knowledge__preference,161.71,25,19,preference_10,Isaac believes it's likely that his boss prefers working remotely over working in-person.,Isaac,male,likely,70,2.552
GSYId1BFlpP3Dz5ej6oUtIMxjKK2,63dd3dd2593c92be97d8dbde,6625d6d2ec6c3c89f6d9b3ea,10__imperfect_knowledge__preference,161.71,8,20,imperfect_knowledge_8,Camille believes it's very likely that she can derive the theorem presented in class today within 5 minutes.,Camille,female,very likely,85,4.017
GSYId1BFlpP3Dz5ej6oUtIMxjKK2,63dd3dd2593c92be97d8dbde,6625d6d2ec6c3c89f6d9b3ea,10__imperfect_knowledge__preference,161.71,9,21,imperfect_knowledge_9,Marco believes it's probable that the local college baseball game starts at 9am on Sunday.,Marco,male,probable,60,2.904
GSYId1BFlpP3Dz5ej6oUtIMxjKK2,63dd3dd2593c92be97d8dbde,6625d6d2ec6c3c89f6d9b3ea,10__imperfect_knowledge__preference,161.71,20,22,preference_5,Johnnie believes his cousin prefers summer over winter.,Johnnie,male,control,60,3.769
GSYId1BFlpP3Dz5ej6oUtIMxjKK2,63dd3dd2593c92be97d8dbde,6625d6d2ec6c3c89f6d9b3ea,10__imperfect_knowledge__preference,161.71,10,23,imperfect_knowledge_10,Roxanne believes it's likely that the hiking trail is 10 miles long.,Roxanne,female,likely,70,3.825
GSYId1BFlpP3Dz5ej6oUtIMxjKK2,63dd3dd2593c92be97d8dbde,6625d6d2ec6c3c89f6d9b3ea,10__imperfect_knowledge__preference,161.71,2,24,imperfect_knowledge_2,Silvia believes it's doubtful that there is a yoga studio within 2 miles of her workplace.,Silvia,female,doubtful,25,4.9590000000000005
GSYId1BFlpP3Dz5ej6oUtIMxjKK2,63dd3dd2593c92be97d8dbde,6625d6d2ec6c3c89f6d9b3ea,10__imperfect_knowledge__preference,161.71,26,25,preference_11,Violet believes it's somewhat likely that her neighbor prefers dogs over cats.,Violet,female,somewhat likely,70,4.1770000000000005
GSYId1BFlpP3Dz5ej6oUtIMxjKK2,63dd3dd2593c92be97d8dbde,6625d6d2ec6c3c89f6d9b3ea,10__imperfect_knowledge__preference,161.71,4,26,imperfect_knowledge_4,Kenny believes it's highly unlikely that the temperature in the office is at least 72 degrees Fahrenheit.,Kenny,male,highly unlikely,10,3.12
GSYId1BFlpP3Dz5ej6oUtIMxjKK2,63dd3dd2593c92be97d8dbde,6625d6d2ec6c3c89f6d9b3ea,10__imperfect_knowledge__preference,161.71,15,27,preference_0,Laura believes it's unlikely that her cousin prefers spinach over broccoli.,Laura,female,unlikely,20,5.297
GSYId1BFlpP3Dz5ej6oUtIMxjKK2,63dd3dd2593c92be97d8dbde,6625d6d2ec6c3c89f6d9b3ea,10__imperfect_knowledge__preference,161.71,22,28,preference_7,Raul believes it's highly likely that his friend prefers stargazing over birdwatching.,Raul,male,highly likely,90,3.656
GSYId1BFlpP3Dz5ej6oUtIMxjKK2,63dd3dd2593c92be97d8dbde,6625d6d2ec6c3c89f6d9b3ea,10__imperfect_knowledge__preference,161.71,13,29,imperfect_knowledge_13,Lance believes it's uncertain that his boss meets the new client at least two times per week.,Lance,male,uncertain,25,2.912
GSYId1BFlpP3Dz5ej6oUtIMxjKK2,63dd3dd2593c92be97d8dbde,6625d6d2ec6c3c89f6d9b3ea,10__imperfect_knowledge__preference,161.71,28,30,preference_13,Tara believes it's uncertain that her cousin prefers headphones over earbuds.,Tara,female,uncertain,20,2.56
PnoUNOw3yfOHiVnxJ0Q4CGUolMD2,6276d97e209059496d37bf74,6625d6d36c9a32f1e867023c,12__future__possession,571.682,12,1,future_12,Bonnie believes it's possible that her landlord will increase her rent by the end of spring.,Bonnie,female,possible,50,19.399
PnoUNOw3yfOHiVnxJ0Q4CGUolMD2,6276d97e209059496d37bf74,6625d6d36c9a32f1e867023c,12__future__possession,571.682,15,2,possession_0,Laura believes it's doubtful that her boss owns a blue car.,Laura,female,doubtful,10,8.998
PnoUNOw3yfOHiVnxJ0Q4CGUolMD2,6276d97e209059496d37bf74,6625d6d36c9a32f1e867023c,12__future__possession,571.682,1,3,future_1,Ethel believes it's very unlikely that she will be offered a promotion this fall.,Ethel,female,very unlikely,15,12.919
