firebase_id,prolific_pid,session_id,sentence_set_id,total_time_taken,question_id,question_index,statement_id,statement_text,name,gender,uncertainty_expression,response,time_taken
EnzvQ8UNMJZwk54Qmz4IsjEibf23,66106de7b3f2dbb98745308c,661d6d1cbecc0691ea1dcdd7,0__future__possession,568.082,27,11,possession_12,Brendan believes it's doubtful that his colleague has enough cash to invest in a local business.,Brendan,male,doubtful,5,15.805
EnzvQ8UNMJZwk54Qmz4IsjEibf23,66106de7b3f2dbb98745308c,661d6d1cbecc0691ea1dcdd7,0__future__possession,568.082,28,12,possession_13,Tara believes it's very unlikely that her friend has the right skills for the job.,Tara,female,very unlikely,5,18.18
EnzvQ8UNMJZwk54Qmz4IsjEibf23,66106de7b3f2dbb98745308c,661d6d1cbecc0691ea1dcdd7,0__future__possession,568.082,6,13,future_6,Nathan believes it's somewhat likely that the band will play his favorite song at the upcoming concert.,Nathan,male,somewhat likely,70,8.256
EnzvQ8UNMJZwk54Qmz4IsjEibf23,66106de7b3f2dbb98745308c,661d6d1cbecc0691ea1dcdd7,0__future__possession,568.082,1,14,future_1,Ethel believes it's almost certain that she will be offered a promotion this fall.,Ethel,female,almost certain,95,14.158
EnzvQ8UNMJZwk54Qmz4IsjEibf23,66106de7b3f2dbb98745308c,661d6d1cbecc0691ea1dcdd7,0__future__possession,568.082,11,15,future_11,Gary believes it's not likely that the defendant will be found guilty on all charges.,Gary,male,not likely,5,27.347
EnzvQ8UNMJZwk54Qmz4IsjEibf23,66106de7b3f2dbb98745308c,661d6d1cbecc0691ea1dcdd7,0__future__possession,568.082,3,16,future_3,Mike believes it's very likely that there will be vegetarian options at the barbecue.,Mike,male,very likely,100,9.501
EnzvQ8UNMJZwk54Qmz4IsjEibf23,66106de7b3f2dbb98745308c,661d6d1cbecc0691ea1dcdd7,0__future__possession,568.082,12,17,future_12,Bonnie believes it's doubtful that her landlord will increase her rent by the end of spring.,Bonnie,female,doubtful,20,35.066
EnzvQ8UNMJZwk54Qmz4IsjEibf23,66106de7b3f2dbb98745308c,661d6d1cbecc0691ea1dcdd7,0__future__possession,568.082,14,18,future_14,Joey believes it's highly unlikely that the hotels nearby will be fully booked by mid January.,Joey,male,highly unlikely,95,11.438
EnzvQ8UNMJZwk54Qmz4IsjEibf23,66106de7b3f2dbb98745308c,661d6d1cbecc0691ea1dcdd7,0__future__possession,568.082,23,19,possession_8,Olga believes it's uncertain that her boss has three pets.,Olga,female,uncertain,50,17.214
EnzvQ8UNMJZwk54Qmz4IsjEibf23,66106de7b3f2dbb98745308c,661d6d1cbecc0691ea1dcdd7,0__future__possession,568.082,15,20,possession_0,Laura believes her boss owns a blue car.,Laura,female,control,100,6.614
EnzvQ8UNMJZwk54Qmz4IsjEibf23,66106de7b3f2dbb98745308c,661d6d1cbecc0691ea1dcdd7,0__future__possession,568.082,5,21,future_5,David believes it's likely that investing in his friend's startup will yield positive returns.,David,male,likely,100,19.068
EnzvQ8UNMJZwk54Qmz4IsjEibf23,66106de7b3f2dbb98745308c,661d6d1cbecc0691ea1dcdd7,0__future__possession,568.082,4,22,future_4,Kenny believes it's probable that he will visit New York over winter break.,Kenny,male,probable,80,7.5600000000000005
EnzvQ8UNMJZwk54Qmz4IsjEibf23,66106de7b3f2dbb98745308c,661d6d1cbecc0691ea1dcdd7,0__future__possession,568.082,25,23,possession_10,Isaac believes it's unlikely that his cousin owns a high-quality camera.,Isaac,male,unlikely,0,10.121
EnzvQ8UNMJZwk54Qmz4IsjEibf23,66106de7b3f2dbb98745308c,661d6d1cbecc0691ea1dcdd7,0__future__possession,568.082,2,24,future_2,Silvia believes it's highly likely that the company will have another round of lay-offs by mid July.,Silvia,female,highly likely,95,6.288
EnzvQ8UNMJZwk54Qmz4IsjEibf23,66106de7b3f2dbb98745308c,661d6d1cbecc0691ea1dcdd7,0__future__possession,568.082,9,25,future_9,Marco believes it's possible that his patient's symptoms will improve within the next two weeks.,Marco,male,possible,85,11.047
EnzvQ8UNMJZwk54Qmz4IsjEibf23,66106de7b3f2dbb98745308c,661d6d1cbecc0691ea1dcdd7,0__future__possession,568.082,19,26,possession_4,Nick believes it's probable that his boss has a stereo amplifier.,Nick,male,probable,80,9.704
EnzvQ8UNMJZwk54Qmz4IsjEibf23,66106de7b3f2dbb98745308c,661d6d1cbecc0691ea1dcdd7,0__future__possession,568.082,13,27,future_13,Lance believes it's very unlikely that his coworkers will go on strike this year.,Lance,male,very unlikely,5,11.001
EnzvQ8UNMJZwk54Qmz4IsjEibf23,66106de7b3f2dbb98745308c,661d6d1cbecc0691ea1dcdd7,0__future__possession,568.082,20,28,possession_5,Johnnie believes it's likely that his friend owns a pressure cooker.,Johnnie,male,likely,90,7.096
EnzvQ8UNMJZwk54Qmz4IsjEibf23,66106de7b3f2dbb98745308c,661d6d1cbecc0691ea1dcdd7,0__future__possession,568.082,21,29,possession_6,Catherine believes it's somewhat likely that her cousin owns a blue bicycle.,Catherine,female,somewhat likely,70,7.178
EnzvQ8UNMJZwk54Qmz4IsjEibf23,66106de7b3f2dbb98745308c,661d6d1cbecc0691ea1dcdd7,0__future__possession,568.082,10,30,future_10,Roxanne believes it's unlikely that her patient will survive another three months.,Roxanne,female,unlikely,15,12.804
3lIZL2KI85ZcowCG2GgzopcMB5y2,63a519bb6eeff2ad74314b53,661d6d1dd7637ca311a67607,5__future__possession,501.12,9,1,future_9,Marco believes it's highly unlikely that his patient's symptoms will improve within the next two weeks.,Marco,male,highly unlikely,50,13.137
3lIZL2KI85ZcowCG2GgzopcMB5y2,63a519bb6eeff2ad74314b53,661d6d1dd7637ca311a67607,5__future__possession,501.12,6,2,future_6,Nathan believes it's not likely that the band will play his favorite song at the upcoming concert.,Nathan,male,not likely,50,8.917
3lIZL2KI85ZcowCG2GgzopcMB5y2,63a519bb6eeff2ad74314b53,661d6d1dd7637ca311a67607,5__future__possession,501.12,15,3,possession_0,Laura believes it's likely that her boss owns a blue car.,Laura,female,likely,50,7.982
3lIZL2KI85ZcowCG2GgzopcMB5y2,63a519bb6eeff2ad74314b53,661d6d1dd7637ca311a67607,5__future__possession,501.12,13,4,future_13,Lance believes it's very likely that his coworkers will go on strike this year.,Lance,male,very likely,75,7.986
3lIZL2KI85ZcowCG2GgzopcMB5y2,63a519bb6eeff2ad74314b53,661d6d1dd7637ca311a67607,5__future__possession,501.12,26,5,possession_11,Violet believes it's almost certain that her coworker has a quiet space to practice meditation.,Violet,female,almost certain,95,7.4430000000000005
3lIZL2KI85ZcowCG2GgzopcMB5y2,63a519bb6eeff2ad74314b53,661d6d1dd7637ca311a67607,5__future__possession,501.12,11,6,future_11,Gary believes it's almost certain that the defendant will be found guilty on all charges.,Gary,male,almost certain,95,6.346
3lIZL2KI85ZcowCG2GgzopcMB5y2,63a519bb6eeff2ad74314b53,661d6d1dd7637ca311a67607,5__future__possession,501.12,21,7,possession_6,Catherine believes it's not likely that her cousin owns a blue bicycle.,Catherine,female,not likely,25,12.183
3lIZL2KI85ZcowCG2GgzopcMB5y2,63a519bb6eeff2ad74314b53,661d6d1dd7637ca311a67607,5__future__possession,501.12,3,8,future_3,Mike believes it's uncertain that there will be vegetarian options at the barbecue.,Mike,male,uncertain,50,43.46
3lIZL2KI85ZcowCG2GgzopcMB5y2,63a519bb6eeff2ad74314b53,661d6d1dd7637ca311a67607,5__future__possession,501.12,14,9,future_14,Joey believes it's probable that the hotels nearby will be fully booked by mid January.,Joey,male,probable,50,48.062
3lIZL2KI85ZcowCG2GgzopcMB5y2,63a519bb6eeff2ad74314b53,661d6d1dd7637ca311a67607,5__future__possession,501.12,29,10,possession_14,Jeffery believes it's probable that his boss has a collection of vintage books.,Jeffery,male,probable,50,5.425
3lIZL2KI85ZcowCG2GgzopcMB5y2,63a519bb6eeff2ad74314b53,661d6d1dd7637ca311a67607,5__future__possession,501.12,25,11,possession_10,Isaac believes his cousin owns a high-quality camera.,Isaac,male,control,100,4.6530000000000005
3lIZL2KI85ZcowCG2GgzopcMB5y2,63a519bb6eeff2ad74314b53,661d6d1dd7637ca311a67607,5__future__possession,501.12,10,12,future_10,Roxanne believes her patient will survive another three months.,Roxanne,female,control,100,3.61
3lIZL2KI85ZcowCG2GgzopcMB5y2,63a519bb6eeff2ad74314b53,661d6d1dd7637ca311a67607,5__future__possession,501.12,19,13,possession_4,Nick believes it's possible that his boss has a stereo amplifier.,Nick,male,possible,75,6.635
3lIZL2KI85ZcowCG2GgzopcMB5y2,63a519bb6eeff2ad74314b53,661d6d1dd7637ca311a67607,5__future__possession,501.12,24,14,possession_9,Bruce believes it's highly unlikely that his friend has all the necessary gear for a camping trip.,Bruce,male,highly unlikely,25,11.569
3lIZL2KI85ZcowCG2GgzopcMB5y2,63a519bb6eeff2ad74314b53,661d6d1dd7637ca311a67607,5__future__possession,501.12,1,15,future_1,Ethel believes it's somewhat likely that she will be offered a promotion this fall.,Ethel,female,somewhat likely,75,12.874
3lIZL2KI85ZcowCG2GgzopcMB5y2,63a519bb6eeff2ad74314b53,661d6d1dd7637ca311a67607,5__future__possession,501.12,5,16,future_5,David believes it's unlikely that investing in his friend's startup will yield positive returns.,David,male,unlikely,100,13.851
3lIZL2KI85ZcowCG2GgzopcMB5y2,63a519bb6eeff2ad74314b53,661d6d1dd7637ca311a67607,5__future__possession,501.12,12,17,future_12,Bonnie believes it's highly likely that her landlord will increase her rent by the end of spring.,Bonnie,female,highly likely,100,5.622
3lIZL2KI85ZcowCG2GgzopcMB5y2,63a519bb6eeff2ad74314b53,661d6d1dd7637ca311a67607,5__future__possession,501.12,7,18,future_7,Cheri believes it's doubtful that there will be pastries provided at the meeting next Monday.,Cheri,female,doubtful,25,8.616
3lIZL2KI85ZcowCG2GgzopcMB5y2,63a519bb6eeff2ad74314b53,661d6d1dd7637ca311a67607,5__future__possession,501.12,20,19,possession_5,Johnnie believes it's unlikely that his friend owns a pressure cooker.,Johnnie,male,unlikely,25,8.123
3lIZL2KI85ZcowCG2GgzopcMB5y2,63a519bb6eeff2ad74314b53,661d6d1dd7637ca311a67607,5__future__possession,501.12,22,20,possession_7,Raul believes it's doubtful that his neighbors have two tickets to the concert in town next Friday.,Raul,male,doubtful,50,7.871
3lIZL2KI85ZcowCG2GgzopcMB5y2,63a519bb6eeff2ad74314b53,661d6d1dd7637ca311a67607,5__future__possession,501.12,8,21,future_8,Camille believes it's very unlikely that her country will be impacted by a hurricane next year.,Camille,female,very unlikely,95,19.277
3lIZL2KI85ZcowCG2GgzopcMB5y2,63a519bb6eeff2ad74314b53,661d6d1dd7637ca311a67607,5__future__possession,501.12,27,22,possession_12,Brendan believes it's highly likely that his colleague has enough cash to invest in a local business.,Brendan,male,highly likely,95,4.126
3lIZL2KI85ZcowCG2GgzopcMB5y2,63a519bb6eeff2ad74314b53,661d6d1dd7637ca311a67607,5__future__possession,501.12,4,23,future_4,Kenny believes it's possible that he will visit New York over winter break.,Kenny,male,possible,50,15.574
3lIZL2KI85ZcowCG2GgzopcMB5y2,63a519bb6eeff2ad74314b53,661d6d1dd7637ca311a67607,5__future__possession,501.12,16,24,possession_1,Jessica believes it's somewhat likely that her friend has a leather jacket.,Jessica,female,somewhat likely,50,7.517
3lIZL2KI85ZcowCG2GgzopcMB5y2,63a519bb6eeff2ad74314b53,661d6d1dd7637ca311a67607,5__future__possession,501.12,23,25,possession_8,Olga believes it's very unlikely that her boss has three pets.,Olga,female,very unlikely,80,9.412
3lIZL2KI85ZcowCG2GgzopcMB5y2,63a519bb6eeff2ad74314b53,661d6d1dd7637ca311a67607,5__future__possession,501.12,28,26,possession_13,Tara believes it's very likely that her friend has the right skills for the job.,Tara,female,very likely,75,8.631
3lIZL2KI85ZcowCG2GgzopcMB5y2,63a519bb6eeff2ad74314b53,661d6d1dd7637ca311a67607,5__future__possession,501.12,2,27,future_2,Silvia believes it's somewhat unlikely that the company will have another round of lay-offs by mid July.,Silvia,female,somewhat unlikely,75,33.029
3lIZL2KI85ZcowCG2GgzopcMB5y2,63a519bb6eeff2ad74314b53,661d6d1dd7637ca311a67607,5__future__possession,501.12,0,28,future_0,Gabriela believes it's likely that she will buy a new watch this Thanksgiving weekend.,Gabriela,female,likely,80,8.133000000000001
3lIZL2KI85ZcowCG2GgzopcMB5y2,63a519bb6eeff2ad74314b53,661d6d1dd7637ca311a67607,5__future__possession,501.12,18,29,possession_3,Jacquelyn believes it's uncertain that her classmate owns a guitar.,Jacquelyn,female,uncertain,20,17.149
3lIZL2KI85ZcowCG2GgzopcMB5y2,63a519bb6eeff2ad74314b53,661d6d1dd7637ca311a67607,5__future__possession,501.12,17,30,possession_2,Amanda believes it's somewhat unlikely that her cousin has a vegetable garden.,Amanda,female,somewhat unlikely,75,8.893
rgKMEYGZvDRMQQjzbxv5rxahHJG2,5ce42b3454e33d001918923a,661d6d1ed226293d47cc644d,8__future__possession,545.592,14,1,future_14,Joey believes it's somewhat unlikely that the hotels nearby will be fully booked by mid January.,Joey,male,somewhat unlikely,55,30.552
rgKMEYGZvDRMQQjzbxv5rxahHJG2,5ce42b3454e33d001918923a,661d6d1ed226293d47cc644d,8__future__possession,545.592,23,2,possession_8,Olga believes it's almost certain that her boss has three pets.,Olga,female,almost certain,90,28.614
rgKMEYGZvDRMQQjzbxv5rxahHJG2,5ce42b3454e33d001918923a,661d6d1ed226293d47cc644d,8__future__possession,545.592,11,3,future_11,Gary believes it's probable that the defendant will be found guilty on all charges.,Gary,male,probable,75,11.999
rgKMEYGZvDRMQQjzbxv5rxahHJG2,5ce42b3454e33d001918923a,661d6d1ed226293d47cc644d,8__future__possession,545.592,17,4,possession_2,Amanda believes it's unlikely that her cousin has a vegetable garden.,Amanda,female,unlikely,30,19.296
rgKMEYGZvDRMQQjzbxv5rxahHJG2,5ce42b3454e33d001918923a,661d6d1ed226293d47cc644d,8__future__possession,545.592,0,5,future_0,Gabriela believes it's uncertain that she will buy a new watch this Thanksgiving weekend.,Gabriela,female,uncertain,50,10.952
rgKMEYGZvDRMQQjzbxv5rxahHJG2,5ce42b3454e33d001918923a,661d6d1ed226293d47cc644d,8__future__possession,545.592,9,6,future_9,Marco believes it's highly likely that his patient's symptoms will improve within the next two weeks.,Marco,male,highly likely,90,11.591000000000001
rgKMEYGZvDRMQQjzbxv5rxahHJG2,5ce42b3454e33d001918923a,661d6d1ed226293d47cc644d,8__future__possession,545.592,29,7,possession_14,Jeffery believes it's somewhat unlikely that his boss has a collection of vintage books.,Jeffery,male,somewhat unlikely,25,12.56
rgKMEYGZvDRMQQjzbxv5rxahHJG2,5ce42b3454e33d001918923a,661d6d1ed226293d47cc644d,8__future__possession,545.592,26,8,possession_11,Violet believes it's probable that her coworker has a quiet space to practice meditation.,Violet,female,probable,90,13.767
rgKMEYGZvDRMQQjzbxv5rxahHJG2,5ce42b3454e33d001918923a,661d6d1ed226293d47cc644d,8__future__possession,545.592,4,9,future_4,Kenny believes it's doubtful that he will visit New York over winter break.,Kenny,male,doubtful,10,10.664
rgKMEYGZvDRMQQjzbxv5rxahHJG2,5ce42b3454e33d001918923a,661d6d1ed226293d47cc644d,8__future__possession,545.592,3,10,future_3,Mike believes it's not likely that there will be vegetarian options at the barbecue.,Mike,male,not likely,5,16.351
rgKMEYGZvDRMQQjzbxv5rxahHJG2,5ce42b3454e33d001918923a,661d6d1ed226293d47cc644d,8__future__possession,545.592,1,11,future_1,Ethel believes it's possible that she will be offered a promotion this fall.,Ethel,female,possible,55,10.983
rgKMEYGZvDRMQQjzbxv5rxahHJG2,5ce42b3454e33d001918923a,661d6d1ed226293d47cc644d,8__future__possession,545.592,12,12,future_12,Bonnie believes it's likely that her landlord will increase her rent by the end of spring.,Bonnie,female,likely,60,9.759
rgKMEYGZvDRMQQjzbxv5rxahHJG2,5ce42b3454e33d001918923a,661d6d1ed226293d47cc644d,8__future__possession,545.592,24,13,possession_9,Bruce believes it's highly likely that his friend has all the necessary gear for a camping trip.,Bruce,male,highly likely,65,14.551
rgKMEYGZvDRMQQjzbxv5rxahHJG2,5ce42b3454e33d001918923a,661d6d1ed226293d47cc644d,8__future__possession,545.592,8,14,future_8,Camille believes it's almost certain that her country will be impacted by a hurricane next year.,Camille,female,almost certain,80,16.327
rgKMEYGZvDRMQQjzbxv5rxahHJG2,5ce42b3454e33d001918923a,661d6d1ed226293d47cc644d,8__future__possession,545.592,2,15,future_2,Silvia believes it's unlikely that the company will have another round of lay-offs by mid July.,Silvia,female,unlikely,25,20.71
rgKMEYGZvDRMQQjzbxv5rxahHJG2,5ce42b3454e33d001918923a,661d6d1ed226293d47cc644d,8__future__possession,545.592,21,16,possession_6,Catherine believes it's highly unlikely that her cousin owns a blue bicycle.,Catherine,female,highly unlikely,10,12.424
rgKMEYGZvDRMQQjzbxv5rxahHJG2,5ce42b3454e33d001918923a,661d6d1ed226293d47cc644d,8__future__possession,545.592,7,17,future_7,Cheri believes there will be pastries provided at the meeting next Monday.,Cheri,female,control,85,9.167
rgKMEYGZvDRMQQjzbxv5rxahHJG2,5ce42b3454e33d001918923a,661d6d1ed226293d47cc644d,8__future__possession,545.592,20,18,possession_5,Johnnie believes it's very unlikely that his friend owns a pressure cooker.,Johnnie,male,very unlikely,5,10.415000000000001
rgKMEYGZvDRMQQjzbxv5rxahHJG2,5ce42b3454e33d001918923a,661d6d1ed226293d47cc644d,8__future__possession,545.592,16,19,possession_1,Jessica believes it's possible that her friend has a leather jacket.,Jessica,female,possible,55,11.743
rgKMEYGZvDRMQQjzbxv5rxahHJG2,5ce42b3454e33d001918923a,661d6d1ed226293d47cc644d,8__future__possession,545.592,13,20,future_13,Lance believes it's somewhat likely that his coworkers will go on strike this year.,Lance,male,somewhat likely,55,9.967
rgKMEYGZvDRMQQjzbxv5rxahHJG2,5ce42b3454e33d001918923a,661d6d1ed226293d47cc644d,8__future__possession,545.592,28,21,possession_13,Tara believes it's somewhat likely that her friend has the right skills for the job.,Tara,female,somewhat likely,70,9.199
rgKMEYGZvDRMQQjzbxv5rxahHJG2,5ce42b3454e33d001918923a,661d6d1ed226293d47cc644d,8__future__possession,545.592,25,22,possession_10,Isaac believes it's very likely that his cousin owns a high-quality camera.,Isaac,male,very likely,90,6.088
rgKMEYGZvDRMQQjzbxv5rxahHJG2,5ce42b3454e33d001918923a,661d6d1ed226293d47cc644d,8__future__possession,545.592,6,23,future_6,Nathan believes it's highly unlikely that the band will play his favorite song at the upcoming concert.,Nathan,male,highly unlikely,25,11.919
rgKMEYGZvDRMQQjzbxv5rxahHJG2,5ce42b3454e33d001918923a,661d6d1ed226293d47cc644d,8__future__possession,545.592,5,24,future_5,David believes it's very unlikely that investing in his friend's startup will yield positive returns.,David,male,very unlikely,10,17.567
rgKMEYGZvDRMQQjzbxv5rxahHJG2,5ce42b3454e33d001918923a,661d6d1ed226293d47cc644d,8__future__possession,545.592,22,25,possession_7,Raul believes his neighbors have two tickets to the concert in town next Friday.,Raul,male,control,65,14.27
rgKMEYGZvDRMQQjzbxv5rxahHJG2,5ce42b3454e33d001918923a,661d6d1ed226293d47cc644d,8__future__possession,545.592,19,26,possession_4,Nick believes it's doubtful that his boss has a stereo amplifier.,Nick,male,doubtful,10,12.063
rgKMEYGZvDRMQQjzbxv5rxahHJG2,5ce42b3454e33d001918923a,661d6d1ed226293d47cc644d,8__future__possession,545.592,18,27,possession_3,Jacquelyn believes it's not likely that her classmate owns a guitar.,Jacquelyn,female,not likely,5,12.535
rgKMEYGZvDRMQQjzbxv5rxahHJG2,5ce42b3454e33d001918923a,661d6d1ed226293d47cc644d,8__future__possession,545.592,27,28,possession_12,Brendan believes it's likely that his colleague has enough cash to invest in a local business.,Brendan,male,likely,75,9.239
rgKMEYGZvDRMQQjzbxv5rxahHJG2,5ce42b3454e33d001918923a,661d6d1ed226293d47cc644d,8__future__possession,545.592,10,29,future_10,Roxanne believes it's very likely that her patient will survive another three months.,Roxanne,female,very likely,100,10.727
rgKMEYGZvDRMQQjzbxv5rxahHJG2,5ce42b3454e33d001918923a,661d6d1ed226293d47cc644d,8__future__possession,545.592,15,30,possession_0,Laura believes it's uncertain that her boss owns a blue car.,Laura,female,uncertain,35,17.759
E7CdSfICrNRRgSoZ5xJpFeA27uZ2,63d2a4b549eb02187fd40092,661d6d1ee66f81dc2daefda8,6__imperfect_knowledge__preference,1738.7730000000001,6,1,imperfect_knowledge_6,Nathan believes it's doubtful that he can fix a flat tire.,Nathan,male,doubtful,20,30.215
E7CdSfICrNRRgSoZ5xJpFeA27uZ2,63d2a4b549eb02187fd40092,661d6d1ee66f81dc2daefda8,6__imperfect_knowledge__preference,1738.7730000000001,11,2,imperfect_knowledge_11,Gary believes it's highly likely that his flight will land around 6pm.,Gary,male,highly likely,95,8.779
E7CdSfICrNRRgSoZ5xJpFeA27uZ2,63d2a4b549eb02187fd40092,661d6d1ee66f81dc2daefda8,6__imperfect_knowledge__preference,1738.7730000000001,8,3,imperfect_knowledge_8,Camille believes it's highly unlikely that she can derive the theorem presented in class today within 5 minutes.,Camille,female,highly unlikely,5,9.895
E7CdSfICrNRRgSoZ5xJpFeA27uZ2,63d2a4b549eb02187fd40092,661d6d1ee66f81dc2daefda8,6__imperfect_knowledge__preference,1738.7730000000001,19,4,preference_4,Nick believes it's unlikely that his coworker prefers reading books over watching movies.,Nick,male,unlikely,30,15.575000000000001
E7CdSfICrNRRgSoZ5xJpFeA27uZ2,63d2a4b549eb02187fd40092,661d6d1ee66f81dc2daefda8,6__imperfect_knowledge__preference,1738.7730000000001,10,5,imperfect_knowledge_10,Roxanne believes it's almost certain that the hiking trail is 10 miles long.,Roxanne,female,almost certain,95,13.977
E7CdSfICrNRRgSoZ5xJpFeA27uZ2,63d2a4b549eb02187fd40092,661d6d1ee66f81dc2daefda8,6__imperfect_knowledge__preference,1738.7730000000001,22,6,preference_7,Raul believes it's very unlikely that his friend prefers stargazing over birdwatching.,Raul,male,very unlikely,10,4.829
E7CdSfICrNRRgSoZ5xJpFeA27uZ2,63d2a4b549eb02187fd40092,661d6d1ee66f81dc2daefda8,6__imperfect_knowledge__preference,1738.7730000000001,2,7,imperfect_knowledge_2,Silvia believes it's uncertain that there is a yoga studio within 2 miles of her workplace.,Silvia,female,uncertain,30,17.552
E7CdSfICrNRRgSoZ5xJpFeA27uZ2,63d2a4b549eb02187fd40092,661d6d1ee66f81dc2daefda8,6__imperfect_knowledge__preference,1738.7730000000001,15,8,preference_0,Laura believes it's somewhat likely that her cousin prefers spinach over broccoli.,Laura,female,somewhat likely,75,8.852
E7CdSfICrNRRgSoZ5xJpFeA27uZ2,63d2a4b549eb02187fd40092,661d6d1ee66f81dc2daefda8,6__imperfect_knowledge__preference,1738.7730000000001,5,9,imperfect_knowledge_5,David believes it's not likely that his presentation on macroeconomics takes 45 minutes.,David,male,not likely,35,91.552
E7CdSfICrNRRgSoZ5xJpFeA27uZ2,63d2a4b549eb02187fd40092,661d6d1ee66f81dc2daefda8,6__imperfect_knowledge__preference,1738.7730000000001,28,10,preference_13,Tara believes it's probable that her cousin prefers headphones over earbuds.,Tara,female,probable,70,481.895
E7CdSfICrNRRgSoZ5xJpFeA27uZ2,63d2a4b549eb02187fd40092,661d6d1ee66f81dc2daefda8,6__imperfect_knowledge__preference,1738.7730000000001,21,11,preference_6,Catherine believes it's doubtful that her boss prefers yoga over pilates.,Catherine,female,doubtful,25,10.5
E7CdSfICrNRRgSoZ5xJpFeA27uZ2,63d2a4b549eb02187fd40092,661d6d1ee66f81dc2daefda8,6__imperfect_knowledge__preference,1738.7730000000001,0,12,imperfect_knowledge_0,Gabriela believes it's somewhat likely that the restaurant near her apartment accepts reservations.,Gabriela,female,somewhat likely,70,5.618
E7CdSfICrNRRgSoZ5xJpFeA27uZ2,63d2a4b549eb02187fd40092,661d6d1ee66f81dc2daefda8,6__imperfect_knowledge__preference,1738.7730000000001,12,13,imperfect_knowledge_12,Bonnie believes it's very likely that she can recall the names of at least seventy countries.,Bonnie,female,very likely,85,6.453
E7CdSfICrNRRgSoZ5xJpFeA27uZ2,63d2a4b549eb02187fd40092,661d6d1ee66f81dc2daefda8,6__imperfect_knowledge__preference,1738.7730000000001,29,14,preference_14,Jeffery believes it's likely that his neighbor prefers dancing over singing.,Jeffery,male,likely,70,9.56
E7CdSfICrNRRgSoZ5xJpFeA27uZ2,63d2a4b549eb02187fd40092,661d6d1ee66f81dc2daefda8,6__imperfect_knowledge__preference,1738.7730000000001,4,15,imperfect_knowledge_4,Kenny believes it's unlikely that the temperature in the office is at least 72 degrees Fahrenheit.,Kenny,male,unlikely,30,5.094
E7CdSfICrNRRgSoZ5xJpFeA27uZ2,63d2a4b549eb02187fd40092,661d6d1ee66f81dc2daefda8,6__imperfect_knowledge__preference,1738.7730000000001,13,16,imperfect_knowledge_13,Lance believes it's probable that his boss meets the new client at least two times per week.,Lance,male,probable,70,6.92
E7CdSfICrNRRgSoZ5xJpFeA27uZ2,63d2a4b549eb02187fd40092,661d6d1ee66f81dc2daefda8,6__imperfect_knowledge__preference,1738.7730000000001,20,17,preference_5,Johnnie believes it's not likely that his cousin prefers summer over winter.,Johnnie,male,not likely,35,12.116
E7CdSfICrNRRgSoZ5xJpFeA27uZ2,63d2a4b549eb02187fd40092,661d6d1ee66f81dc2daefda8,6__imperfect_knowledge__preference,1738.7730000000001,9,18,imperfect_knowledge_9,Marco believes the local college baseball game starts at 9am on Sunday.,Marco,male,control,70,11.232000000000001
E7CdSfICrNRRgSoZ5xJpFeA27uZ2,63d2a4b549eb02187fd40092,661d6d1ee66f81dc2daefda8,6__imperfect_knowledge__preference,1738.7730000000001,23,19,preference_8,Olga believes it's highly unlikely that her neighbor prefers sunrise over sunset.,Olga,female,highly unlikely,10,8.792
E7CdSfICrNRRgSoZ5xJpFeA27uZ2,63d2a4b549eb02187fd40092,661d6d1ee66f81dc2daefda8,6__imperfect_knowledge__preference,1738.7730000000001,17,20,preference_2,Amanda believes it's uncertain that her friend prefers running over cycling.,Amanda,female,uncertain,20,7.207
E7CdSfICrNRRgSoZ5xJpFeA27uZ2,63d2a4b549eb02187fd40092,661d6d1ee66f81dc2daefda8,6__imperfect_knowledge__preference,1738.7730000000001,7,21,imperfect_knowledge_7,Cheri believes it's very unlikely that her friend can do a handstand.,Cheri,female,very unlikely,10,7.862
E7CdSfICrNRRgSoZ5xJpFeA27uZ2,63d2a4b549eb02187fd40092,661d6d1ee66f81dc2daefda8,6__imperfect_knowledge__preference,1738.7730000000001,25,22,preference_10,Isaac believes it's almost certain that his boss prefers working remotely over working in-person.,Isaac,male,almost certain,95,10.444
E7CdSfICrNRRgSoZ5xJpFeA27uZ2,63d2a4b549eb02187fd40092,661d6d1ee66f81dc2daefda8,6__imperfect_knowledge__preference,1738.7730000000001,26,23,preference_11,Violet believes it's highly likely that her neighbor prefers dogs over cats.,Violet,female,highly likely,90,17.32
